{
  "schemaVersion": 1,
  "id": "evening",
  "packageId": "app.xiaoban.environments.evening",
  "packageVersion": "1.1.0",
  "display": {
    "name": "静夜小屋",
    "description": "月色花园映在窗外，暖灯和轻动的窗帘陪着你",
    "category": "indoor",
    "order": 2,
    "thumbnail": "Environment_evening"
  },
  "compatibility": {
    "apiMajor": 1,
    "minApiMinor": 0,
    "required": [
      "environment.geometry@1",
      "environment.lighting@1",
      "environment.palette@1",
      "environment.decor@1"
    ],
    "optional": []
  },
  "source": {
    "kind": "builtin",
    "model": "evening",
    "scale": 1,
    "yaw": 0
  },
  "stage": {
    "referenceHeight": 1.7,
    "clearRadius": 1.2
  },
  "lighting": {
    "sky": "#142A44",
    "ambient": "#485266",
    "key": "#FFD6AD",
    "fill": "#7DA8FF",
    "keyIntensity": 1.15,
    "fillIntensity": 0.24,
    "rimIntensity": 0.65
  },
  "palettes": [
    {
      "id": "original",
      "name": "原色",
      "surface": "#35444C",
      "accent": "#7B9DA6"
    },
    {
      "id": "sage",
      "name": "浅绿",
      "surface": "#AEBDAF",
      "accent": "#8DA291"
    },
    {
      "id": "rose",
      "name": "暖粉",
      "surface": "#CBB6AB",
      "accent": "#C99F96"
    }
  ],
  "bindings": {
    "surface": [],
    "accent": [],
    "decor": [
      "Decor"
    ]
  },
  "license": {
    "spdx": "LicenseRef-ProjectOriginal",
    "file": "LICENSE.txt",
    "attribution": "小伴项目原创程序化场景"
  },
  "files": [
    {
      "path": "LICENSE.txt",
      "bytes": 108,
      "sha256": "fe354d8ef60dc22209df3637617fe97547ae8422b37918228161e7676d707ec6"
    }
  ],
  "extensions": {
    "app.starry.presentation": {
      "revision": 2,
      "owner": "host",
      "distantArt": "NightGarden",
      "localAmbientMotion": true,
      "maxMotionNodes": 24
    }
  }
}
