{
  "schemaVersion": 1,
  "id": "seaside",
  "packageId": "app.xiaoban.environments.seaside",
  "packageVersion": "1.1.0",
  "display": {
    "name": "海边露台",
    "description": "蓝色海岸、细微波光与木质露台，听见夜色",
    "category": "outdoor",
    "order": 4,
    "thumbnail": "Environment_seaside"
  },
  "compatibility": {
    "apiMajor": 1,
    "minApiMinor": 0,
    "required": [
      "environment.geometry@1",
      "environment.lighting@1",
      "environment.palette@1",
      "environment.decor@1"
    ],
    "optional": []
  },
  "source": {
    "kind": "builtin",
    "model": "seaside",
    "scale": 1,
    "yaw": 0
  },
  "stage": {
    "referenceHeight": 1.7,
    "clearRadius": 1.2
  },
  "lighting": {
    "sky": "#405979",
    "ambient": "#788B9B",
    "key": "#E8DBCC",
    "fill": "#91B7D3",
    "keyIntensity": 1.25,
    "fillIntensity": 0.25,
    "rimIntensity": 0.46
  },
  "palettes": [
    {
      "id": "original",
      "name": "原色",
      "surface": "#667274",
      "accent": "#8CABA7"
    },
    {
      "id": "sage",
      "name": "浅绿",
      "surface": "#AEBDAF",
      "accent": "#8DA291"
    },
    {
      "id": "rose",
      "name": "暖粉",
      "surface": "#CBB6AB",
      "accent": "#C99F96"
    }
  ],
  "bindings": {
    "surface": [],
    "accent": [],
    "decor": [
      "Decor"
    ]
  },
  "license": {
    "spdx": "LicenseRef-ProjectOriginal",
    "file": "LICENSE.txt",
    "attribution": "小伴项目原创程序化场景"
  },
  "files": [
    {
      "path": "LICENSE.txt",
      "bytes": 108,
      "sha256": "fe354d8ef60dc22209df3637617fe97547ae8422b37918228161e7676d707ec6"
    }
  ],
  "extensions": {
    "app.starry.presentation": {
      "revision": 2,
      "owner": "host",
      "distantArt": "BlueHourCoast",
      "localAmbientMotion": true,
      "maxMotionNodes": 24
    }
  }
}
